{
  "schemaVersion": 1,
  "family": "F1",
  "familyName": "rules",
  "generator": "scripts/render-reference.mjs",
  "members": [
    {
      "name": "ai-laziness-digest",
      "kind": "rule",
      "shipsTo": {
        "tier": "framework"
      },
      "description": "the resident hot digest — every §2 T-number + its one-line counter (exact-prefix quotes from the catalogue).",
      "source": {
        "path": ".agents/rules/ai-laziness-digest.md",
        "line": 5
      },
      "extras": {
        "class": "A",
        "fires": "any R-phase, audit, sample-based investigation, or open-ended AI task.",
        "channels": "always-on core"
      },
      "example": null
    },
    {
      "name": "ai-laziness-traps",
      "kind": "rule",
      "shipsTo": {
        "tier": "framework"
      },
      "description": "ai-laziness-traps discipline rule — §1 problem this solves, §2 canonical trap catalogue, §3 kickoff-author obligations (cite + extend, no blanket reference), §4 anti-patterns, §5 promotion / retirement triggers.",
      "source": {
        "path": ".agents/rules/ai-laziness-traps.md",
        "line": 20
      },
      "extras": {
        "class": "A",
        "fires": "any R-phase, audit, sample-based investigation, or open-ended AI task.",
        "channels": "paths:(8), edit-time inject"
      },
      "example": null
    },
    {
      "name": "attention-is-not-a-mechanism",
      "kind": "rule",
      "shipsTo": {
        "tier": "framework"
      },
      "description": "the attention-is-not-a-mechanism discipline — §1 the rule (human/AI",
      "source": {
        "path": ".agents/rules/attention-is-not-a-mechanism.md",
        "line": 5
      },
      "extras": {
        "class": "C",
        "fires": "designing any load-bearing check (gate vs. bare human/AI attention).",
        "channels": "always-on core"
      },
      "example": null
    },
    {
      "name": "autonomous-loop-continuity",
      "kind": "rule",
      "shipsTo": {
        "tier": "framework"
      },
      "description": "the autonomous-loop continuity discipline — §1 the stop rule and its mechanism, §2 the wait rule (silence ≠ health), §3 anti-patterns, §4 promotion / retirement.",
      "source": {
        "path": ".agents/rules/autonomous-loop-continuity.md",
        "line": 12
      },
      "extras": {
        "class": "B",
        "fires": "unattended turn ending with work in flight.",
        "channels": "hook, digest"
      },
      "example": null
    },
    {
      "name": "build-first-reuse-default",
      "kind": "rule",
      "shipsTo": {
        "tier": "framework"
      },
      "description": "project-wide macro-level scope discipline; relationship to upstream tools, frameworks, and ecosystems; default verdict for new capability proposals; the consumer map owed before dropping or slimming an established artefact (§3.1); the scope of fresh prior-art re-verification at PR-authoring / orchestration time (§3.2).",
      "source": {
        "path": ".agents/rules/build-first-reuse-default.md",
        "line": 22
      },
      "extras": {
        "class": "A",
        "fires": "capability commit/proposal; shipped-file removal.",
        "channels": "paths:(10), edit-time inject"
      },
      "example": null
    },
    {
      "name": "ci-tool-pinning",
      "kind": "rule",
      "shipsTo": {
        "tier": "framework"
      },
      "description": "CI tool pinning discipline — §1 the two rules (version pin + lockfile-aware install), §2 scope (this repo's `.github/workflows/` + tracked shell scripts), §3 escape hatch, §4 relationship to companion-install-principle.md, §5 promotion / retirement.",
      "source": {
        "path": ".agents/rules/ci-tool-pinning.md",
        "line": 20
      },
      "extras": {
        "class": "A",
        "fires": "editing `.github/workflows/**` or any repo shell script.",
        "channels": "paths:(6), edit-time inject"
      },
      "example": null
    },
    {
      "name": "cold-seat-economy",
      "kind": "rule",
      "shipsTo": {
        "tier": "framework"
      },
      "description": "the cold-seat economy discipline — §1 re-audit on substance not SHA, §2 seat ordering (expensive WHAT-audit last, on the final diff), §3 follow-up rounds (fresh narrow seat + watch-list by default; resume the exception), §4 anti-patterns, §5 promotion / retirement, §7 immutable seat inputs + one named ref per answer.",
      "source": {
        "path": ".agents/rules/cold-seat-economy.md",
        "line": 17
      },
      "extras": {
        "class": "C",
        "fires": "re-running a cold seat; resume-vs-fresh; pinning seat inputs to a SHA.",
        "channels": "skill-embed(3)"
      },
      "example": null
    },
    {
      "name": "companion-install-principle",
      "kind": "rule",
      "shipsTo": {
        "tier": "framework"
      },
      "description": "how this project installs companions/external services — §1 the principle, §2 trigger, §3 the manifest mechanism, §4 promotion / retirement.",
      "source": {
        "path": ".agents/rules/companion-install-principle.md",
        "line": 14
      },
      "extras": {
        "class": "B",
        "fires": "editing `setup.d/**` (companion install manifest/engine).",
        "channels": "paths:(1), edit-time inject"
      },
      "example": null
    },
    {
      "name": "coordinator-seat-delegation",
      "kind": "rule",
      "shipsTo": {
        "tier": "framework"
      },
      "description": "the seat-vs-worker split — §1 the rule, §2 anti-patterns, §3 promotion / retirement.",
      "source": {
        "path": ".agents/rules/coordinator-seat-delegation.md",
        "line": 19
      },
      "extras": {
        "class": "C",
        "fires": "a coordinator seat about to run the stage pipeline itself.",
        "channels": "paths:(2)"
      },
      "example": null
    },
    {
      "name": "destination-environment-verification",
      "kind": "rule",
      "shipsTo": {
        "tier": "framework"
      },
      "description": "the destination-environment verification discipline — §1 the positive contract and its grammar, §1b the negative direction (claims that the destination *cannot*), §2 the incident base, §3 why a green container run is not evidence, §4 anti-patterns, §5 promotion / retirement.",
      "source": {
        "path": ".agents/rules/destination-environment-verification.md",
        "line": 14
      },
      "extras": {
        "class": "B",
        "fires": "kickoff authoring; accepting container work; a cannot-reach claim.",
        "channels": "paths:(1), edit-time inject"
      },
      "example": null
    },
    {
      "name": "doc-authority-hierarchy",
      "kind": "rule",
      "shipsTo": {
        "tier": "framework"
      },
      "description": "doc-authority-hierarchy discipline rule — §2 doc categorisation, §3 header format spec, §4 five anti-patterns + §4.1 supersession clause (premise change amends the declaring artefact), §5 folder-level authority pattern, §6 promotion / demotion / retirement triggers.",
      "source": {
        "path": ".agents/rules/doc-authority-hierarchy.md",
        "line": 20
      },
      "extras": {
        "class": "A",
        "fires": "creating/editing any canonical or shipped consumer-facing doc.",
        "channels": "paths:(7), edit-time inject"
      },
      "example": null
    },
    {
      "name": "dual-implementation-discipline",
      "kind": "rule",
      "shipsTo": {
        "tier": "framework"
      },
      "description": "dual-implementation discipline rule — §1 problem, §2 triggers + non-triggers, §3 audience triage, §4 detection mechanism, §5 drift check, §6 CC-bias mitigation, §7 single source of truth, §8 anti-patterns, §9 promotion / retirement, §10 see also.",
      "source": {
        "path": ".agents/rules/dual-implementation-discipline.md",
        "line": 19
      },
      "extras": {
        "class": "A",
        "fires": "shipping a new CC-native hook + choosing its delivery channel(s).",
        "channels": "paths:(6), edit-time inject"
      },
      "example": null
    },
    {
      "name": "effort-worthiness",
      "kind": "rule",
      "shipsTo": {
        "tier": "framework"
      },
      "description": "the effort-worthiness discipline — §1 the rule + four-test card,",
      "source": {
        "path": ".agents/rules/effort-worthiness.md",
        "line": 10
      },
      "extras": {
        "class": "C",
        "fires": "any effort/rigor fork: probe demand, extra round, budget breach.",
        "channels": "skill-embed(4)"
      },
      "example": null
    },
    {
      "name": "egress-no-api-bypass",
      "kind": "rule",
      "shipsTo": {
        "tier": "framework"
      },
      "description": "the egress channel-preference rule — §1 the two channels (host-push default / API break-glass), §2 trigger, §3 mechanism + why the container cannot push, §4 promotion / retirement, §5 §1.7 self-reflexive note.",
      "source": {
        "path": ".agents/rules/egress-no-api-bypass.md",
        "line": 7
      },
      "extras": {
        "class": "B",
        "fires": "harvesting/egressing a finished aif-agent branch to a PR.",
        "channels": "skill-embed"
      },
      "example": null
    },
    {
      "name": "evidence-regeneration",
      "kind": "rule",
      "shipsTo": {
        "tier": "framework"
      },
      "description": "the evidence-regeneration procedure — §1 the rule, §2 the verified per-backend loop (numbered) + the safety interlocks, §3 the two entry conditions + the firing-evidence invariant, §4 the paste-from-fresh-stdout anti-theatre rule, §5 anti-patterns, §6 promotion/retirement.",
      "source": {
        "path": ".agents/rules/evidence-regeneration.md",
        "line": 14
      },
      "extras": {
        "class": "B",
        "fires": "a freshness gate RED, or a first live-fired matrix cell.",
        "channels": "paths:(1), edit-time inject"
      },
      "example": null